<?xml version="1.0" encoding="UTF-8"?>
<!--Sample XML file generated by XMLSpy v2009 sp1 (http://www.altova.com)-->
<tmi8:VV_TM_PUSH xsi:schemaLocation="http://bison.connekt.nl/tmi8/kv4/msg kv4-msg.xsd" xmlns:tmi8c="http://bison.connekt.nl/tmi8/kv4/core" xmlns:tmi8="http://bison.connekt.nl/tmi8/kv4/msg" xmlns:xsi="http://www.w3.org/2001/XMLSchema-instance">
	<tmi8:SubscriberID>ONBEKEND</tmi8:SubscriberID>
	<tmi8:Version>8.1.1</tmi8:Version>
	<tmi8:DossierName>KV4relatedjourneys</tmi8:DossierName>
	<tmi8:Timestamp>2009-11-20T13:19:00Z</tmi8:Timestamp>
	<tmi8:KV4relatedjourneys>
		<!-- twee elementen, een zonder en een uitbreiding -->
		<tmi8:RELATEDJOURNEY>
			<!-- element zonder uitbreiding -->
			<tmi8:timestamp>2001-12-17T09:30:47Z</tmi8:timestamp>
			<tmi8:dataownercode>abcdefghij</tmi8:dataownercode>
			<tmi8:operatingday>2009-11-20</tmi8:operatingday>
			<tmi8:vehiclenumber>123456</tmi8:vehiclenumber>
			<tmi8:arrivingblockcode>12345678</tmi8:arrivingblockcode>
			<tmi8:arrivinglineplanningnumber>abcdefghij</tmi8:arrivinglineplanningnumber>
			<tmi8:arrivingjourneynumber>123456</tmi8:arrivingjourneynumber>
			<tmi8:arrivingreinforcementnumber>99</tmi8:arrivingreinforcementnumber>
			<tmi8:arrivingvehiclejourneytype>SERVICEJOURNEY</tmi8:arrivingvehiclejourneytype>
			<tmi8:departingblockcode>12345678</tmi8:departingblockcode>
			<tmi8:departinglineplanningnumber>jihgfedcba</tmi8:departinglineplanningnumber>
			<tmi8:departingjourneynumber>654321</tmi8:departingjourneynumber>
			<tmi8:departingreinforcementnumber>00</tmi8:departingreinforcementnumber>
			<tmi8:departingvehiclejourneytype>SERVICEJOURNEY</tmi8:departingvehiclejourneytype>
			<!-- optionele veld -->
			<tmi8:vehiclelength>123</tmi8:vehiclelength>
		</tmi8:RELATEDJOURNEY>
		<tmi8:RELATEDJOURNEY>
			<!-- element met uitbreiding -->
			<tmi8:timestamp>2001-12-17T09:30:47Z</tmi8:timestamp>
			<tmi8:dataownercode>abcdefghij</tmi8:dataownercode>
			<tmi8:operatingday>2009-11-20</tmi8:operatingday>
			<tmi8:vehiclenumber>123456</tmi8:vehiclenumber>
			<tmi8:arrivingblockcode>12345678</tmi8:arrivingblockcode>
			<tmi8:arrivinglineplanningnumber>abcdefghij</tmi8:arrivinglineplanningnumber>
			<tmi8:arrivingjourneynumber>123456</tmi8:arrivingjourneynumber>
			<tmi8:arrivingreinforcementnumber>99</tmi8:arrivingreinforcementnumber>
			<tmi8:arrivingvehiclejourneytype>SERVICEJOURNEY</tmi8:arrivingvehiclejourneytype>
			<tmi8:departingblockcode>12345678</tmi8:departingblockcode>
			<tmi8:departinglineplanningnumber>jihgfedcba</tmi8:departinglineplanningnumber>
			<tmi8:departingjourneynumber>654321</tmi8:departingjourneynumber>
			<tmi8:departingreinforcementnumber>00</tmi8:departingreinforcementnumber>
			<tmi8:departingvehiclejourneytype>SERVICEJOURNEY</tmi8:departingvehiclejourneytype>
			<!-- optionele veld -->
			<tmi8:vehiclelength>123</tmi8:vehiclelength>
			<!-- uitbreidings veld -->
			<tmi8c:delimiter since="String"/>
			<!-- uitbreidingen vinden hier plaats -->
			<uitbreiding>voor toekomstige velden in het element</uitbreiding>
		</tmi8:RELATEDJOURNEY>
		<tmi8c:delimiter since="String"/>
		<!-- extra elementen worden hierachter ingeschoven -->
		<tmi8:TOEKOMSTIGELEMENT>
			<tmi8:toekomstigeveldeninhettoekomstigelement>INFORMATIE</tmi8:toekomstigeveldeninhettoekomstigelement>
		</tmi8:TOEKOMSTIGELEMENT>
	</tmi8:KV4relatedjourneys>
</tmi8:VV_TM_PUSH>
